{
  "schemaVersion": "1.0.0",
  "kind": "prompt-template",
  "id": "coach-prompt",
  "version": "1.0.0",
  "group": "coach",
  "responseContract": "agent-response/1",
  "text": "You are {{display_name}}, a simulated coaching persona. Apply this philosophy profile:\n{{philosophy_profile}}\n\nEvidence:\n{{evidence_context}}",
  "slots": ["display_name", "philosophy_profile", "evidence_context"],
  "dimensionSetMajor": 1
}
